{
  "$schema": "https://json-schema.org/draft/2020-12/schema",
  "$id": "https://collabcentral.example/schedule-viewer/field-extensions.schema.json",
  "title": "Schedule viewer field extension",
  "type": "object",
  "additionalProperties": false,
  "required": ["schemaVersion", "id", "name", "fields"],
  "properties": {
    "schemaVersion": {
      "type": "integer",
      "const": 1
    },
    "id": {
      "type": "string",
      "minLength": 1
    },
    "name": {
      "type": "string",
      "minLength": 1
    },
    "fields": {
      "type": "array",
      "minItems": 1,
      "items": { "$ref": "#/$defs/extensionFieldDefinition" }
    }
  },
  "$defs": {
    "extensionFieldDefinition": {
      "type": "object",
      "additionalProperties": false,
      "required": ["id", "name", "type"],
      "properties": {
        "id": { "type": "string", "minLength": 1 },
        "name": { "type": "string", "minLength": 1 },
        "type": {
          "type": "string",
          "enum": ["text", "number", "date", "choice"]
        },
        "meaning": { "type": "string", "minLength": 1 },
        "instruction": { "type": "string", "minLength": 1 },
        "required": { "const": true },
        "default": {},
        "percent": { "const": true },
        "choices": {
          "type": "array",
          "minItems": 1,
          "items": { "type": "string", "minLength": 1 }
        }
      },
      "allOf": [
        {
          "if": {
            "properties": { "type": { "const": "choice" } },
            "required": ["type"]
          },
          "then": { "required": ["choices"] }
        }
      ]
    }
  }
}
