{
  "schemaVersion": 1,
  "id": "sample",
  "name": "サンプル追加項目",
  "fields": [
    {
      "id": "memo",
      "name": "メモ",
      "type": "text"
    },
    {
      "id": "score",
      "name": "点数",
      "type": "number"
    },
    {
      "id": "ratio",
      "name": "消化率",
      "type": "number",
      "percent": true
    },
    {
      "id": "due",
      "name": "確認日",
      "type": "date"
    },
    {
      "id": "lane",
      "name": "区分",
      "type": "choice",
      "choices": [
        "内製",
        "外注"
      ]
    }
  ]
}
